"text","page"
"This thinker examined the use of analogy using the grammatically similar sentences ""A has a gold tooth"" and ""A has a toothache."" This thinker was inspired by the way traffic courts in Paris model car accidents with toy cars to propose his ""picture theory,"" which was included in work that begins ""The world is all that is the case.""  This author of the (*) Blue and Brown Books argued that ""What we cannot speak of we must pass over in silence"" and refuted the possibility of a private language using  the example of a beetle in a box. For ten points, name this Austrian philosopher whose works include Philosophical Investigations and Tractatus Logico-Philosophicus.","Ludwig_Wittgenstein"
"It notes that speech is the most noble of inventions and concludes with a suggestion that ""the darkness"" of vain philosophy can be avoided by analyzing language. This work also posits that motion is the universal cause of behavior and introduces its author's ""Theory of Obligation."" [*] Its later sections test the claims of scripture, which is usually used to obfuscate the truth, by asking ""Who benefits?"" and its 27th chapter compares the papacy with the kingdom of the fairies. This treatise discusses the Laws of Nature or ""articles of peace"" to argue for the superiority of the monarchy. Subtitled ""or the Matter, Form, and Power of a Commonwealth, Ecclesiastical and Civil,"" FTP identify this work which describes the life of man as ""solitary, poor, nasty, brutish, and short,"" a work by Thomas Hobbes.","Leviathan_(Hobbes_book)"
"He decried a scientific approach to history in his On the Uses and Disadvantages of History for Life, an essay included in his early volume, Untimely Meditations. He was strongly influenced by the theories of Heraclitus, but blamed Socrates for the decline of Athenian drama in The Birth of Tragedy. His theory of eternal recurrence posited that the universe went through cycles of existence, a view praised in The Gay Science and Ecce Homo. More famous were his claim that Christianity warped classical definitions of good and bad and his call for a ""transvaluation of all values"", which were included in On the Genealogy of Morality. This 19th century German thinker's Beyond Good and Evil elaborates on his most famous ideas of the Will to Power and the Übermensch. For ten points, name this philosopher who wrote that ""God is dead"" in Thus Spoke Zarathustra.","Friedrich_Nietzsche"
"This man's Metaphysics focuses on separating essential from accidental properties of objects, while his Physics lists four types of causes and five elements of matter. . He is called ""the master of those who know"" in Dante's Inferno, and Bertrand Russell claimed that every intellectual advance must begin with by attacking this philosopher. This man's Politics stressed balance between democratic and oligarchic governments, while his  Poetics emphasize the importance of catharsis. He wrote extremely detailed works on zoology, but is better known for his theory of a tripartite soul. He is most famous, however, for his ethical theories, which claim that the goal of human existence eudaimonia, which is achieved by living a life of virtue. For ten points, name this author of the Nichomachean Ethics who founded the Lyceum in Athens, and was the student of Plato and teacher of Alexander the Great.","Aristotle"
"This man's less famous works include the Prolegomena to Any Future Metaphysics, while his most important work attempts to determine whether a priori synthetic judgments are possible. In that work, this author distinguishes the noumenal and phenomenal realms, and states his intention to create the equivalent of the Copernican revolution in metaphysics. His most famous idea in ethics can be stated either as the  necessity of regarding human beings as ends in themselves. For ten points, name this founder of German  idealism, who developed the categorical imperative in his Groundwork for the Metaphysics of Morals and claimed that things in themselves could not be perceived in his Critique of Pure Reason.","Immanuel_Kant"
"One work by this thinker claimed that the source of happiness was ""far niente""  or ""doing nothing"", and that work was a series of meditations on this man's exile, titled Reveries of a Solitary Walker. Another of this thinker's works claims, ""The search... for principles and axioms in science... is beyond a woman's grasp,"" and that work was heavily criticized by Mary Wollstonecraft. This thinker advocated splitting administration into two parts: a ""sovereign"" to represent the general will, and a ""government"" to apply the law, in a work which states, ""The legislative power belongs to the people, and can belong to it alone."" For 10 points, name this author of Emile, who stated, ""Man is born free, and everywhere he is in chains,"" in The Social Contract.","Jean-Jacques_Rousseau"
"In one work, this philosopher argued that words name things but the utterance of a word is what carries signification. In that same work, this philosopher also argued that mutual fear and not mutual love between men informs their decision to enter society.  That work by this philosopher is De Cive and forms a trilogy with his De Corpore and De Homine.  This philosopher argued that absolute monarchy is the only form of government that can guarantee peace in his best known work, where he postulates that life without government would be ""bellum omnium contra omnes"", or a ""war of all against all."" For ten points, name this political philosopher who wrote on the social contract in Leviathan.","Thomas_Hobbes"
"This man was the first to correctly explain how rainbows worked, while he posited a mind-body dualism in his Meditations on First Philosophy. In another of this French philosopher's works, he introduced a coordinate system and tried to prove the existence of God. This work is the Discourse on Method. FOR TEN POINTS, name this philosopher who lends his name to the Cartesian plane and is best-known for the phrase, ""cogito ergo sum.""","René_Descartes"
"Though this person's opera The Village Blacksmith was a moderate success, the disapproval of J.P.  Rameau ceased his composition of music. This writer's The Reveries of the Solitary Walker are of  secondary importance to another autobiography, and his sequel to a well-known work, Julie, is little-read today. This thinker's Discourse on Inequality is discussed in his autobiographical Confessions. FTP, name this author of The Social Contract and Émile; a Swiss-French philosopher of the eighteenth century.","Jean-Jacques_Rousseau"
"Positing the pineal gland as the resolving his namesake dualism problem, this person derived the result known as Snell's law independent of Snell. Known for the Meditations on First Philosophy that he produced in 1641, this thinker's four-part major work, Essais philosophiques, was published in 1637 and included the notable Discourse on Method. FTP, name this French mathematician and philosopher who coined the saying ""Cogito Ergo Sum,"" ""I think, therefore I am.""","René_Descartes"
"This man's lesser-known works include The Elements of Law and Body, Mind, and Citizen. His  philosophy was marked by a secular justification for the state, as he was an ardent materialist. He believed  that men were in a constant battle against everything, and that the only way to restore peace and order was  to create a government, a sort of authoritarian social contract. FTP, name this British philosopher and  political theorist, a contemporary of Descartes, and the author of Leviathan.","Thomas_Hobbes"
"Author of A Critical Exposition of the Philosophy of Leibniz and Marriage and Morals, he was influenced by McTaggart and married the Quaker Alys Pearsall Smith. He wrote a dissertation on the foundations of geometry and published his first book on German Social Democracy. His last works were An Inquiry into Meaning and Truth and Human Knowledge, Its Scope and Limits, and his trip to Russia resulted in the critical The Practice and Theory of Bolshevism. Imprisoned for his pacifism during World War I, FTP name this English philosopher who collaborated with Whitehead on Principia Mathematica.","Bertrand_Russell"
"In four essays, Herman Rapaport wrote about the recent works of this man, which discuss his interpretation of Tonnies's concepts of Gemeinschaft and Gesellschaft. This philosopher delineated the nature of ""voyous"" in Rogues: Two Essays on Reason. He discussed Patocka's Heretical Essays on the History of Philosophy and critiqued Kierkegaard's Fear and Trembling in the work The Gift of Death. He studied under Louis Althusser, and in 1954, examined the internal tension in Husserl's central notion of ""genesis."" Later works include Speech and Phenomena and Writing and Difference, and his most famous work discusses an anti-Kantian approach to language. FTP, name this author of Of Grammatology, the developer of deconstruction.","Jacques_Derrida"
"He focused on the U.S. in such works as Character and Opinion in the United States and The Genteel Tradition at Bay. He became interested in the systems of Plato and Aristotle and divided his works into the personal and the academic. Some of his other works include Lucifer: A Theological Tragedy, Dialogues in Limbo, and the memoirs Persons and Places. FTP name this philosopher, a long-time professor at Harvard who wrote The Sense of Beauty and The Last Puritan, perhaps best remembered for saying that ""those who forget history are condemned to repeat it.""","George_Santayana"
"Identify the philosopher from clues 30-20-10  30: He argued that the most profound human experience is the reflection of the prospect of one's own death, because this ""possibility of impossibility"" reveals the finitude of human being as both a limitation and an incentive to living in the world.  20: He also placed particular emphasis on language as the vehicle through which human beings can reencounter themselves and on the special role poetry plays in the development and function of language. A sample of his lesser known works include On the Way to Language and What Is Called Thinking?  10: This 20th century philosopher's most important work united two philosophical approaches--the existentialism of Soren Kierkegaard and Friedrich Nietzsche and the phenomenology of Husserl--in his Being and Time.","Martin_Heidegger"
"This thinker introduced his concept of ""the doctrine of the mean"" as a balance between excess and deficiency, the ideal expression of virtue. In addition to that work named after his son, he described his impetus theory of motion in his Physics. In Politics, he claimed that the title entity is dynamic and comes before family and the individual. He stated that the objective of tragedy is to invoke catharsis in Poetics. For 10 points, name this Greek Peripatetic philosopher who wrote The Nicomachean Ethics and was taught by Plato.","Aristotle"
"This philosopher claimed that altruism arises from a low self-esteem in his work Daybreak. He collected short works in his Untimely Meditations, and he attributes his wisdom to his sensitivity of the weight of others. In his first major work, he compared writings of Euripides between Dionysian and Apollonian works in his The Birth of Tragedy. He makes a famous claim in his work The Gay Science, and another of his works speaks about ""the will to power"" and the ubermensch. For 10 points, name this German philosopher of Thus Spoke Zarathustra and Beyond Good and Evil who famously stated ""God is dead.""","Friedrich_Nietzsche"
"This thinker claimed something is beautiful if it seems to have been designed with purpose despite any obvious practical use, a term called the ""form of finality."" In another work, this thinker argues that mathematics and science contain synthetic a priori knowledge because scientific truths are universally true, independent of experience. He introduced a concept that states people should act only according to that maxim, which they will to become a universal law without contradiction. This concept, true in and of- itself, is called the categorical imperative. For 10  points, name this philosopher who authored The Critique of Judgment, Groundwork for the Metaphysics of Morals, and the Critique of Pure Reason.","Immanuel_Kant"
"This philosopher presented the first treatment of the propositional calculus as a calculus of truth-functions, and extended Boole's algebra to the logic of relations, distinguishing between polyadic, dyadic, and monadic relations. Studying philosophy in his leisure time, in his essay ""Fixation of Belief"" he defined true ideas as those to which responsible investigators would assent after thorough examination and stated that one's idea of anything is the idea of its sensible effects distinguished according to their practical significance. FTP, who was this American founder of pragmatism?","Charles_Sanders_Peirce"
"This philosopher theorized a union of rational beings known as his ""Kingdom of Ends,"" and he advocated the abolition of standing armies in order to achieve the titular state in Perpetual Peace. This philosopher credited David Hume's An Enquiry Concerning Human Understanding with awakening him from his ""dogmatic slumber."" He rejected empiricism and advocated the concept of a priori knowledge in one work. His Groundwork of the Metaphysics of Morals stated that the moral value of an idea is determined by whether one could wish it to be a universal law, an idea known as the categorical imperative. FTP, name this German philosopher who wrote Critique of Pure Reason.","Immanuel_Kant"
"This philosophical work attacks most poetry and art because of its imitative nature, and one statement is ethically expanded by the two ""pleasure proofs"". It divides people into Workers, Auxiliaries, and Guardians, and one central idea is said to be ""the advantage of the stronger"". It declares that an ideal state is ruled by philosophers and creates the doctrine that experience is known through shadows which are only manifestations of true reality, which consists of ideas called ""forms"". One famous section characterizes people as facing away from the light while chained up in a cave. FTP, name this work in which Socrates debates the nature of justice, a Platonic dialogue which has a title referring to a form of government.","Republic_(Plato)"
"Early in his career, this man edited the Critical Journal of Philosophy with Joseph Schelling, whom he contrasted with Fichte in his first book. He later engaged in intense verbal warfare with Arthur Schopenhauer, whom he accused of distorting Kant's philosophy, and who in turn responded by claiming that he used big words to cover up the fact that he did not have any real ideas. He compared ""judgment"" and ""inference"" in one work and created the ""master-servant"" dialectic in another. FTP, name this German philosopher who wrote Science of Logic and The Phenomenology of Spirit.","Georg_Wilhelm_Friedrich_Hegel"
"In one work, this philosopher compares two 1799 and 1851 coups in France, and in another he attacked the anarchist philosophy of Pierre-Joseph Proudhon. In addition to The Eighteenth Brumaire of Louis Napoleon and The Poverty of Philosophy, one of his works stated, ""Labour cannot emancipate itself in the white skin where in the black it is branded"", and in another work he wrote ""Working men of the world, unite!"" after stating that ""the proletarians have nothing to lose but their chains"". FTP, name this German philosopher who wrote Das Kapital and worked with Friedrich Engels on The Communist Manifesto.","Karl_Marx"
"The ability to always apply this type of ethics correctly is possessed by the ""archangels"" posited by Richard Hare. In Rethinking Life and Death, Peter Singer applies the ""preference"" form of this ethical philosophy to abortion and euthanasia. David Lyons disputes a common distinction drawn between forms of this philosophy that consider broad rules and individual acts. Derek Parfit suggests that the ""repugnant conclusion"" follows from ""mere addition"" across a population in applying this theory. For 10 points, name this consequentialist ethical philosophy that suggested that the good was to do the greatest happiness to the greatest number, supported by figures like Mill and Bentham.","Utilitarianism"
"This philosopher considered the role of humanity in enframing the truth and considered the ""supreme danger"" and ""saving power"" of edifices like hydroelectric power plants in his work The Question Concerning Technology. This philosopher claimed that the title object established a struggle between that which is ready-to-hand and that which is unintelligible to what is ready- to-hand, or between ""World"" and ""Earth,"" in The Origin of the Work of Art. His best known work suggests its first title subject must be understood by progressive cycles through a ""hermeneutic circle"" and posits a being he calls Dasein. For 10 points, name this author of Being and Time.","Martin_Heidegger"
"His best-known work was first translated by Frank Ramsey and establishes, in its first part, the picture theory of propositions, and a later work by this philosopher suggests that knowledge of the meaning of words requires external criteria for verification, denying the possibility of a private language, which he supported with his thought experiment of a beetle in a box. This author's late work centered on the idea of ""language games"" and was expressed in works like Philosophical Investigations. For 10 points, name this philosopher of mind and language who wrote the Tractatus Logico-Philosophicus.","Ludwig_Wittgenstein"
"This philosopher rejected the distinction between primary and secondary qualities on the grounds that an object cannot have the former without the latter. He rejected the proposals of Descartes and others regarding the use of natural geometry and comparison with past observations, instead suggesting that a customary connection with kinesthetic sensation explained the perception of distance in his Essay Towards a New Theory of Vision. This philosopher derided fluxions as the ""ghosts of departed quantities"" in his critique of calculus titled The Analyst. For 10 points, name this British Idealist who believed that ""esse est percipi"" and wrote Three Dialogues Between Hylas and Philonous.","George_Berkeley"
"This philosopher had a long exchange with Jonas Proast following one of his works. He warned that ""promises, covenants, and oaths... can have no hold upon an atheist""in a work supporting a diversity of religious denominations; that work, addressed to Philipp van Limborch, is A Letter Concerning Toleration. This philosopher supported silver and gold for their ""pledge"" value, whereas paper money could only be used as a ""counter"" of value, and one of his best-known works begins by attacking Filmer's Patriarcha, Two Treatises of Government. For 10 points, name this political philosopher who believed the mind originated as a tabula rasa and who wrote An Essay Concerning Human Understanding.","John_Locke"
"One work by this thinker enumerated four possible classes of objects in relation to a given subject, which he called becoming, knowing, being, and willing, while another praised Dutch still life as the highest form of art. While at the University of Berlin, this thinker intentionally scheduled his lectures to conflict with Hegel's, and he called the Upanishads ""the production of the highest human wisdom."" Positing art as the only means of escaping the suffering inherent in the act of willing, he is known primarily for the skepticism showcased by his magnum opus. For 10 points, name this German philosopher, author of The World as Will and Representation.","Arthur_Schopenhauer"
"One chapter of this work compares imagination to the lights one sees upon pressing one's eye, and calls previous philosophers ""ancient pretenders to natural knowledge"" that chapter questions why Jesus suggests spirits cannot be incorporeal. That chapter is from its third part, ""Of a Christian Commonwealth,"" while an earlier chapter establishes the ""first and second natural laws"" and explains that a man may transfer his freedom to another via a covenant. This work supposes that before the creation of the first state, humanity existed in a ""war of all against all,"" the state of nature. For 10 points, name this work of Thomas Hobbes.","Leviathan_(Hobbes_book)"
"This philosopher, who praised the Confederation of Bar for saving a certain nation, considered ""the question of the three orders"" in his Considerations on the Government of Poland and dedicated to an idealized Geneva his Discourse on Inequality. Oscar Wilde wrote that ""Robespierre came out of the pages of"" this man, who recommended giving children a tutor who would arrange organic learning experiences, and who in his best-known work he described the mechanism by which the sovereign makes an agreement with the government. For 10 points, name this rival to Voltaire and author of Emile who discussed the free-born ""noble savage"" and wrote The Social Contract.","Jean-Jacques_Rousseau"
"One work by this philosopher remarks upon that ""most mendacious minute"" wherein humanity decides that its own concept of truth and falsity is a meaningful one. In addition to that work, ""On Truth and Lies in a Nonmoral Sense,"" this philosopher speculated that Greek choruses were always played by satyrs in a work contrasting the Apollonian and Dionysian, The Birth of Tragedy. This author of Beyond Good and Evil wrote a work that proclaimed that ""God is dead... and we have killed him."" For 10 points, name this author of The Gay Science and Thus Spoke Zarathustra, a German philosopher who created the Ubermensch.","Friedrich_Nietzsche"
"This author's essay ""Violence and Metaphysics"" considered the works of Emmanuel Levinas, and this author addressed Austin's speech-act theory in ""Signature Event Context,"" which drew heavy criticism from John Searle. He termed the point at which the realization of foundational contradictions arises an ""aporia,"" from the Greek for ‘puzzle' or ‘confusion,' and posited this point as unavoidable in rigorous analysis of any text. For 10 points, name this French-Algerian philosopher, author of On Grammatology and developer of deconstruction.","Jacques_Derrida"
"This philosopher noted that the exclusion of lepers eventually transitioned to other exclusion rituals in an analogy of a ship of fools. His genealogy of knowledge is a direct allusion to Nietzsche's genealogy of morality. This thinker developed the concept of the medical gaze in his The Birth of the Clinic and argued that the conditions of discourse changed over time in The (*) Order of Things. This man analyzed Bentham's Panopticon in work,.and he developed the theory of biopower in his The Will to Knowledge. For ten points, name this French philosopher and author of Discipline and Punish.","Michel_Foucault"
"This philosopher contended that the first thing to do in conducting state affairs is to ""rectify names"", and emphasized music and archery among the ""Six Arts"". One follower of this philosopher used the example of reactions to a child falling down a well to exemplify innate goodness, which begins the Trimetric Classic. This namesake of a philosophy advocated by (*) Mencius argued that rulers must cultivate ""ren"", or compassion, which formed the basis of the Mandate of Heaven. He also regarded filial piety as the most basic form of altruism. For ten points, name this Chinese philosopher whose beliefs are collected in the Analects.","Confucius"
"In one of his works, this philosopher used the example of a slave solving a complicated geometry problem to show that certain knowledge is innate, and also explained how the universe was created from a combination of ""Sameness"", ""Difference"", and ""Existence"". Another work by this man describes the Sun as the child of the Form of the Good and uses a (*) parable of a ship to argue for justice as harmony. That work by this author of Meno and Timaeus also posited an ideal city-state governed by philosopher-kings and described chained prisoners observing shadows in its Allegory of the Cave. For ten points, name this Greek philosopher and author of The Republic, a student of Socrates and teacher of Aristotle.","Plato"
"This philosopher claimed that the mind can be filled wholly with joy by loving something eternal and infinite and  argued that because miracles are declared according to the understanding of ignorant masses, they cannot be used to prove God's existence.  This author of On the Improvement of the Understanding discussed how it follows from the nature of a triangle that its three interior angles should not be equal to two right angles and claimed that God is (*) Nature and Nature is God in his most famous work, which refutes Descartes's mind-body dualism and advocates Pantheism. For ten points, name this excommunicated Dutch Jewish philosopher who wrote Tractatus Theologico- Politicus and Ethics.","Baruch_Spinoza"
"This philosopher argued that great art is the result of hard work, not of genius or divine inspiration, in a compilation of aphorisms originally dedicated to Voltaire. This author of Human, All too Human discussed the dichotomy between the Apollonian and Dionysian aspects of literature in The (*) Birth of Tragedy and also called amor fati the ""formula for greatness in a human being"". He identified master and slaves form of the title concept in On the Genealogy of Morals, and suggested that the ""will to power"" explains all human behavior in Beyond Good and Evil. For ten points, name this German author of Ecce Homo, whose The Gay Science claimed ""God is Dead.""","Friedrich_Nietzsche"
