"text","page"
"In one work, this philosopher debunks the conception of children as essentially being small versions of adults. In another work, the collective of all citizens is viewed as a separate body from the government known as the state when passive and the sovereign when active. In that work, this philosopher stresses the importance of expressing the general will and states that citizens secure liberation from the state of nature by entering in the titular agreement. For 10 points, name this French author of Emile and The Social Contract.","Jean-Jacques_Rousseau"
"This philosopher advocated defining a complex idea by breaking it down into simple ideas and tracing each of the simple ideas to the impressions from which they are derived, a method based on the ""copy principle."" One principle named for him divides statements into relations of ideas and matters of fact, and another states that you cannot get an ""ought"" from an ""is."" In addition to his namesake ""law"" or ""guillotine"" and ""fork,"" he authored A Treatise of Human Nature. For 10 points, name this Scottish philosopher who wrote An Enquiry Concerning Human Understanding.","David_Hume"
"In one work, this philosopher equated the Christian concept of sin with human despair, and in another, he introduced the ""knight of infinite resignation"" while elaborating variations on the story of Abraham's sacrifice of Isaac. In addition to The Sickness Unto Death and Fear and Trembling, he wrote a work including the diary of Johannes the Seducer compiled by Victor Eremita which contrasts the ethical and aesthetic ways of life. For 10 points, name this existentialist Danish philosopher who wrote Either/Or.","Søren_Kierkegaard"
"In one work, this philosopher theorized an early form of the modern research institute describing a utopia dedicated to scientific discovery called Solomon's House. In another work, he criticized the distinction between proof and invention in Aristotle's syllogistic logic and suggested observation or experience as the first step in an inductive method which laid the groundwork of the scientific method. For 10 points, name this English philosopher who wrote The Advancement of Learning, The New Atlantis, and Novum Organum.","Francis_Bacon"
"In one work by this philosopher, the reforms of the Tuke brothers and Philippe Pinel are partially blamed for a new theory of the central concept based on opposing reason. In another work, Bentham's panopticon is used to interpret the modern prison system. That earlier work analyzes the modern psychiatrist as a method for secluding in silence people with the titular malady, and he wrote The Will to Knowledge as the first volume of his The History of Sexuality. For 10 points, name this French philosopher who wrote Discipline and Punish and Madness and Civilization.","Michel_Foucault"
"In one work, this philosopher identified matter, essence, spirit, and truth as the four characteristics of knowledge, and in another work, he argued that one title concept leads to the conclusion that a single instant of awareness is empty of concepts and that the other title concept is the irrational basis for knowledge claims. For 10 points, name this naturalist Spanish-American philosopher who wrote The Realms of Being and Skepticism and Animal Faith and is known for the saying ""Those who cannot remember the past are condemned to repeat it.""","George_Santayana"
"Louis Jacobs summarized this man's belief about gods as ""God is not ‘outside' or apart from Nature; He did not create nature but is nature."" This writer stated that a mind could find joy by loving something eternal and infinite in his work On the Improvement of the Understanding. He also argued that religion could allow contrarian philosophizing without endangering the state in his Tractatus Theologico-Politicus, while his most famous book was called ""a geometrical order"". Excommunicated in 1656 by the Jewish community, name this Dutch philosopher who wrote Ethics.","Baruch_Spinoza"
"This philosopher argued that states themselves were eventually to be subsumed under the hierarchy of world history, but described the state as ""The March of God through the world"". He compared two philosophers in his The Difference Between Fichte's and Schelling's Systems of Philosophy. He also wrote The Science of Logic, and in his most famous work, he created sections on Reason, Spirit, and Religion, and discussed his famous triad composed of thesis, antithesis, and synthesis. Name this philosopher who popularized the dialectic and wrote The Philosophy of Right and The Phenomenology of Mind.","Georg_Wilhelm_Friedrich_Hegel"
"A posthumous work of this thinker sees Cleanthes' use of the teleological argument attacked by Philo, who claims human reason cannot understand the divine. Book I of another work by this author discusses skepticism and the importance of the experimental method. When it was unsuccessful, that book was edited into a work that includes a discussion of human reason compared to animal reason, as well as sections titled ""Of Probability,"" ""Of Liberty and Necessity,"" and ""Of Miracles."" The author of Dialogues Concerning Natural Religion, name this Scottish Empiricist philosopher and author of Treatise of Human Nature and An Enquiry Concerning Human Understanding.","David_Hume"
"In one of his works, this thinker attributes his wisdom to his sensitivity to people's health. That work's last section bases its conclusion on the power of his ideas to overturn a sick morality. His first tract reinterpreted ancient Greek culture and was called The Birth of Tragedy. His autobiography was subtitled ""How One Becomes What One Is"" and included several chapters like ""Why I Write Such Good Books"", ""Why I Am So Wise"", and ""Why I Am So Clever"". Other chapters are named after this writer's other works, such as Thus Spoke Zarathustra and a book that included hundreds of aphorisms, Beyond Good and Evil. Name this philosopher whose The Gay Science stated that ""God is dead"", the German author of Ecce Homo.","Friedrich_Nietzsche"
"Shortly before an unsuccessful summit between this man and the Jansenist theologian Antoine Arnauld, which was aimed at reunifying Protestants and Catholics, this writer put forth his theory of ""the soul in a point"" in his New Physical Hypothesis. He opposed the ""mechanics"" of Descartes with his own system of motion called ""dynamics,"" and he strongly endorsed the ""principle of sufficient reason,"" or the notion that this is the best of all possible worlds. For 10 points, name this German philosopher who also feuded with Isaac Newton over the invention of calculus.","Gottfried_Wilhelm_Leibniz"
"This man discussed the characteristics of Nietzsche's thoughts in one lecture in What is Called Thinking? and outlined ""Two Ways of Transcendental Deduction"" in Kant and the Problems of Metaphysics. He examined the meaning of Van Gogh's ""A Pair of Shoes"" in The Origin of the Work of Art, a work that appeared after this man's philosophy underwent a ""turn"" or ""Die Kehre."" For 10 points, identify this philosopher who outlined the threefold structure of scientific questioning in ""What is Metaphysics?"" and posited that existence, fallenness, and thrownness as the origin of Dasein in his work Being and Time.","Martin_Heidegger"
"This author dubbed Averroes ""The Commentator,"" and he authored the tracts ""On Kingship"" and ""On Being and Essence"" in addition to a work against Averroes, On There Being only One Intellect. One of this author's works contrasts two types of truths, those accessible to human intellect, and those like the sacraments for which reason does not stand. He claimed that there must exist an ""unmoved mover"" in his magnum opus. For 10 points, name this ""Doctor Angelicus,"" the author of Summa Contra Gentiles who outlined five proofs of God's existence in his unfinished masterpiece, Summa Theologica.","Thomas_Aquinas"
"Book III of this work claims that a necessary ""noble lie"" is the basis for the title concept. One character in this work argues that justice is ""the advantage of the stronger."" In this work, Glaucon tells the story of a shepherd who is corrupted after discovering the invisibility-enabling Ring of Gyges. Also featuring the metaphors of the divided line and of the sun, this work contains a thought experiment about some shackled slaves who see shadows on a wall. For 10 points, name this work that sees Thrasymachus's arguments countered, a Platonic dialogue that contains the Allegory of the Cave and asserts that the title place would be ruled by philosophers.","Republic_(Plato)"
"According to this book, the conservation of motion is the cause of human thoughts. Stating that imagination is at the start of all voluntary actions, it sets forth the premise of a mechanistic universe. The author denies the existence of devils and suggests that a ""confederacy of deceivers"" creates ""the Kingdom of Darkness."" The third book about a Christian Commonwealth annoyed the audience because it declared civil laws more important than religious laws. It suggests that a social contract to obey an absolute authority represented by the titular entity is necessary to avoid the war of all against all. Life is ""nasty, brutish, and short,"" according to, for 10 points, what work by Thomas Hobbes?","Leviathan_(Hobbes_book)"
"This philosopher concluded that Enlightenment and Humanism are in a ""state of tension rather than identity"" in one work. This author of the essays ""What is an Author?"" wrote one work that begins by noting that leprosy had disappeared in the Western world by the middle ages. One work by this author of The Order of Things and The Archaeology of Knowledge centers on modern medicine, and is subtitled ""An Archeology of Medical Perception,"" and this author of Madness and Civilization studied Bentham's Panopticon in one work. For 10 points, name this French philosopher of The Birth of the Clinic and Discipline and Punish.","Michel_Foucault"
"He claimed that the three heads of Good that men pursue are riches, fame, and pleasure in a work examining the differences between false, fictitious, and doubtful ideas, On the Improvement of Understanding. He argued that prophets are not necessarily intelligent but simply imaginative and emphasized that religion should stay out of politics in Tractatus Theologico-Politicus, but his only work published under his name was about his contemporary, Descartes. His definition of God as Being with infinitely many attributes appeared in a work in ""geometric order"" and reflects his pantheism. For 10 points, name this Dutch Jew who wrote Ethics.","Baruch_Spinoza"
"This scholar noted that philosophy serves as an antidote against false religion and superstition in a work often paired with ""On the Immortality of the Soul,"" ""On Suicide."" In the third book of a work that ""fell dead-born from the press,"" he argued that morality can not be explained by reason, and the copy principle is introduced in ""Of the Understanding."" He noted the circularity of inductive reasoning, and argued that constant conjunction of events does not mean causality. His namesake law relates to the is-ought problem, and Relations of Ideas and Matters of Fact form his namesake fork. For 10 points, name this Scottish skeptic philosopher of An Enquiry Concerning Human Understanding.","David_Hume"
"One member of this school of philosophy named desire, action, and assent in his outline of the ""three topics"" one must study. That man, who studied under Musonius Rufus, wrote two books compiled by Flavius Arrian, The Discourses and The Handbook. Its key concept was pneuma, the breath of life that gives structure to life, and its minor adherents include Panaetius and Posidonius. The pupil of Cleanthes, Chyrsippus of Soli, is said to be the second founder of this school, named for the painted porch that its teachers taught from. For 10 points, Epictetus and Marcus Aurelius practiced what system of philosophy founded by Zeno of Citium?","Stoicism"
"In one work, the alter ego of this man attacks the empiricist position of Philalethes, arguing in favor of innatism. That alterego, Theophilus, rejects the ""tabula rasa"" in a work meant to rebut Locke, New Essays on Human Understanding. He also proposed that there is no physical causation; rather God designed everything to occur the way it does and created ""pre-established harmony."" This author of Theodicy and Monadology also believed in ""sufficient reason,"" a concept for which he was satirized in Candide as Dr. Pangloss, a character who maintains the faith that he lives in the best of all worlds. For 10 points, name this rationalist who invented calculus independently of Newton.","Gottfried_Wilhelm_Leibniz"
"This scholar contrasted dead choices with genuine choices, which are live, forced, and momentous, and he argued that some propositions must be accepted without prior evidence in ""The Will to Believe."" He rejected monism and proposed a multi-verse in A Pluralistic Universe. His most famous work questions whether a man chasing a squirrel around a tree is going around the squirrel, and his Gifford lectures were collected in his The Varieties of Religious Experience. For 10 points, name this American philosopher who coined the term ""stream of consciousness"" and wrote Pragmatism.","William_James"
"This man commented on Emmanuel Swedenborg in Dreams of a Spirit Seer and discussed ratiocination in The False Subtlety of the Four Syllogistic Figures. He proposed that the maxim Sapere aude is the answer to the title question, ""What is Enlightenment?"" Moreover, he asserted that humans should be treated as an end rather than a means to an end and that all people should act as universal legislators in Groundwork of the Metaphysics of Morals. He famously distinguished between synthetic-analytic and a priori-a posteriori and introduced the categorical imperative. For 10 points, name this German writer of The Critique of Pure Reason.","Immanuel_Kant"
"The lectures of Alexandre Kojève revitalized this philosopher in Paris. The title concept of his most famous work, often compared to a bildungsroman, ultimately culminates in the ""Absolute Knowledge""; it also describes a death struggle of consciousness, which then becomes master and slave. This author of Encyclopedia of the Philosophical Sciences and The Science of Logic famously used history as an example of the thesis-antithesis-synthesis process, his namesake dialectic. For 10 points, name this author of The Phenomenology of Spirit.","Georg_Wilhelm_Friedrich_Hegel"
"In his first important work, this philosopher noted that Egypt fell after philosophy flourished and praised Sparta for banishing artists and scientists. In addition to ""Discourse on the Sciences and Arts,"" this author of Reveries of a Solitary Walker wrote about Saint-Preux who desperately loves the ""New Heloise"" in Julie. This contributor of music articles to Diderot's Encyclopedia asserted the importance of teaching self-worth in education in Emile. His most famous work, which states that ""Man was born free but everywhere he is in chains,"" examines how society controls people through the ""general will."" For 10 points, name this author of The Social Contract.","Jean-Jacques_Rousseau"
"This man equated matter with potency and distinguished between essential and accidental existence in ""On the Principles of Nature."" In response to Siger of Brabant's support of Averroes, he also wrote ""On There Being Only One Intellect."" His best known work was completed by Reginald of Piperno, because he had died on his way to the Second Council of Lyons. That work, which referred to Peter Lombard as the Master, consists of a series objections followed by refutations beginning ""I answer that."" For 10 points, Summa contra Gentiles was the work of what scholastic student of Albertus Magnus, best known for Summa Theologica?","Thomas_Aquinas"
"This philosopher wrote about Newtonian dynamics and other science in De Motu. He argued that distance is determined by the viewer and that sight is really a process of thought in his Essay Towards a New Theory of Vision. One of his works is framed as conversations between one student who dislikes skeptics who deny a ""material substance,"" and another who claims that all matter is relative, culminating in the statement that ""to be is to be perceived"". For 10 points, name this Irish bishop, an empiricist who wrote Treatise Concerning the Principles of Human Knowledge and Three Dialogues between Hylas and Philonous.","George_Berkeley"
"In a work co-written with Arthur Bentley this thinker articulates the long standing ""terminological problem,"" which has generated misguided types of inquiry labeled ""Self-Action,"" ""Interaction,"" and ""Transaction."" In addition to that work Knowing and the Known, this social activist was one of the original co-signers of the Humanist Manifesto.  He wrote a critical exposition of Leibniz's philosophy as well as a work written in response to Walter Lippmann's The Phantom Public entitled The Public and its Problems. He claims that the ""burn is the original seeing,"" in an essay that seeks to correct an operating metaphor regarding the connection between stimulus and response, the so-called ""reflex arc."" For 10 points, name this American pragmatist philosopher and educational reformer author of Art as Experience, and Democracy and Education.","John_Dewey"
"Ezra Pound amusingly used the example of a bunch of illiterate fishermen worrying about Greek pronunciation to parody this man's The Idea of Christ in the Gospels. This man claimed that one of his major concepts aspires to ""the full truth and perfect good"" which ""dwells like the God of Egypt in a dark inner chamber"" in an essay about that concept in ""the sanctuary. He famously stated ""The American Will inhabits the skyscraper"" in his lecture ""The Genteel Tradition in American Philosophy."" This author of The Birth of Reason and the autobiography Persons and Places divided one major work into four works on truth, spirit, matter, and essence. Besides Realms of Being, his most famous work asserts that there could be no rational approach to understanding the world without the titular belief that attributes inhere in existents. For ten points, name this author of Skepticism and Animal Faith, a Spanish-American philosopher.","George_Santayana"
"In a work possibly written by this figure the ""unwritten doctrine"" is presented, which claims that a serious man in dealing with serious subjects ""carefully avoids writing."" That work, the so-called Seventh Letter, belongs to a group of works whose authenticity is questioned such as Hippias Major. In another work, this author formulates the concept of the kairos, the ability of a judge to decide between the right and wrong moment to undertake an enterprise, and thus he rejects the sovereignty of the law in Statesmen. In yet another work, a figure informs us that love is a longing for immortality, a philosophy that figure learned from a female seer named Diotima. That work by this author also sees Alcibiades barge in and interrupt a party held in honor of Agathon. For 10 points, name this ancient Greek philosopher author of the Symposium and the Republic.","Plato"
"This thinker's development of a non-dialectical path to social organization and liberation stands as a radical exception to bourgeois trajectory of thought according to Antonio Negri's analysis of his thought, The Savage Anomaly. A 1780 public dispute between F.H Jacobi and Gotthold Lessing centered on this man's philosophy. like Hobbes this thinker adopts an amoralist stance regarding ""natural right"" but unlike Hobbes concludes in one work that democracy and not monarchy is the most natural form of state. In a major work he articulates a substance-monism wherein modes and attributes of that infinite substance give rise to variety and attempted to organize those arguments relating God, substance and humanity in a ""Geometrical Manner."" For 10 points, name this author of the Tractatus Theologico-Politicus and Ethics a Dutch Jewish philosopher.","Baruch_Spinoza"
"This thinker used the example of a classmate who claimed that he could not rightfully fail an agregation, while the titular person passed in order to show, ""if the Jew did not exist, the anti-Semite would invent him."" A psychoanalytic presentation of a playwright who became a ward of the French State is contained in this author's Saint Genet, Actor and Martyr. Raymond Aron claimed that this thinker was attempting an impossible union of Kierkegaard and Marx in his work, Search for a Method, which would later serve as introduction to a longer work on applying that method through ""dialectic circularity."" In another work subtitled ""An Essay Phenomenological Ontology,"" he outlines the in-itself and for-itself categories of being and describes the vertigo or anguish in the face of radical choice as mauvaise foi, or bad faith. For 10 points, name this French existentialist philosopher who had a tumultuous relationship with Simon de Beauvoir.","Jean-Paul_Sartre"
"This thinker's early work was focused on natural philosophy and includes a self-described unsuccessful attempt to mediate between Cartesian and Leibnizian theories of physical force as well four essays on earthquakes and winds. Besides writing, Thoughts on the True Estimation of Living Forces, this philosopher asserts that the laws of nature and the laws of human conduct are compatible precisely because they are both products of human thought in his last work, The Conflict of the Faculties. His work on religion includes an essay ridiculing metaphysical theories as the fantasies of the Swedish Theosophist Emmanuel Swedenborg whom this author calls a ""Spirit Seer,"" and rejects both the ontological argument and the argument from design in The Only Possible Argument. For 10 points, name this philosopher who answered the question ""What is Enlightenment,"" and rejects the supposed right to lie due to philanthropic concerns in a supplement to his Groundwork for the Metaphysics of Morals.","Immanuel_Kant"
"This thinker calls man a ""microcosmos"" in a work directed to the King of Cyprus, and cites Aristotle's Politics in suggesting that merchants encourage interactions with foreigners, which are dangerous to civic customs in On Kingship. Martin de Azpilcueta of the Salamanca School utilizes this figure's articulation of the just price theory to formulate a cost-of-production theory of value. In a short opusculum to Pope Urban IV, this theologian outlines the teachings of the Latin Church in ostensible opposition to the Eastern Church in Against the Errors of the Greeks. It is apocryphal that a branch fell on his head while traveling on his way to the Second Council of Lyon leading to his death, and in this theologian's best known work, he articulated the Quinque viae or five arguments for the existence of God. A student of Albert Magnus, for 10 points, name this Catholic theologian who wrote Summa Contra Gentiles and Summa Theologica.","Thomas_Aquinas"
"This man contributed the chapter ""Social Unity and Primary Goods"" to Amartya Sen's work Utilitarianism and Beyond. One of this man's works grudgingly accommodates what he terms decent hierarchical peoples, which are in opposition to liberal peoples; that work generalizes his philosophy to international relations and is entitled The Law of Peoples. The formulator of the Lexical Difference Principle, another of his works contains addresses the idea that government should be neutral between competing conceptions of the good by arguing for what he terms ""overlapping consensus"" and is entitled Political Liberalism. One of this man's most famous works was redone as the essay ""Justice as Fairness;"" that essay contains a concept which asks the society to construct itself in full ignorance of any person's role, the veil of ignorance. For ten points, name this philosopher who wrote A Theory of Justice.","John_Rawls"
"In one work, this man argued through his Copy Principle that all simple ideas originate from simple impressions, only to provide a counter-example by describing a missing shade of blue. In that same work by this philosopher, the phrase ""a violation of the laws of nature"" is used to define a concept in the chapter ""Of (*) Miracles."" For 10 points, name this Scottish philosopher who supported the philosophy of empiricism in his works, which included A Treatise of Human Nature and An Enquiry concerning Human Understanding.","David_Hume"
"One argument put forward by this man considers a man looking at every possible shade of a certain color and seeing a blank at one point. That idea of the ""missing shade of blue"" can be found in this man's ""Of the Origins of Ideas."" Another work by this man features Demea, Philo, and Cleanthes debating the existence of God. Immanuel (*) Kant credited this author of Dialogues Concerning Natural Religion for awakening him from a ""dogmatic slumber.""For 10 points name this Scottish philosopher and writer of An Enquiry Concerning Human Understanding.","David_Hume"
"In one of this man's works, he argued that the design argument was flawed due to an incomplete analogy and lack of experience of multiple universes. In contrast to the rationalists who preceded him, he stated in one of his works that ""Reason is, and ought only to be the slave of the passions."" In that work, A Treatise of Human Nature, he also argued against causality, denying that one can ever perceive cause and effect. In another work, he discusses the idea that only through prior experience can causal relationships be found. For 10 points, name the author of An Enquiry Concerning Human Understanding.","David_Hume"
