"text","page"
"This philosopher wrote that what he called the ""first class of objects for the subject"" could not be represented without the ""union of Time and Space."" This thinker believed that, while other forms of art are too concerned with human forms, music is the direct articulation of the basis of life and should be atop a hierarchy of the arts. This thinker critiqued the method of symmetrical analogy in his criticism of the schemata of (*) Kant, whose idea of ding-an-sich he rejected. This man, whose dissertation elaborated on principles of causality, drew upon the Upanishads in a work that proposes denying the will-to-life through asceticism to escape omnipresent suffering. For 10 points, name this man who discussed the ""fourfold root"" of the principle of sufficient reason, a pessimistic dude who penned The World as Will and Representation.","Arthur_Schopenhauer"
"This philosopher noted that ""the absence of a work of art"" was Antonin Artaud's version of one concept that he exemplified with an engraving by Sebastian Brandt. This philosopher argued that the birth of modern literature came with a process of ""the return of language"" which occurred alongside ""the birth of man."" This philosopher opened one of his books by noting the superimposition found in a model's gaze in a work of (*) art in which the painter is looking back at us. This philosopher noted that, as leprosy died off, the literary ""ship of fools"" became commonplace in a book arguing that the insane were treated with kindness during the Renaissance. He analyzed Las Meninas in the opening of a book that attempts to be ""An Archaeology of the Human Sciences."" For 10 points, name this French author of Madness and Civilization and The Order of Things.","Michel_Foucault"
"This philosopher put forth eight principles for determining the international order in a book that envisages a world in which the evils of history no longer occur, called a ""realistic utopia."" This philosopher called political theories that depend on compliant actors and favorable social conditions ""ideal theory."" This philosopher describe a method by which, through adjusting one's general principles so that they mutually support one another, one can arrive at a state of (*) ""reflective equilibrium."" The ideas of this author of The Law of Peoples prompted Robert Nozick to write Anarchy, State, and Utopia. He used a thought experiment in which parties design a society without knowing their status, due to a ""veil of ignorance,"" to argue that society should work to benefit the most disadvantaged. For 10 points, name this author of A Theory of Justice.","John_Rawls"
"This philosopher criticized the ""pragmatic"" method of one subject for attempting to provide moral lessons that it argues leaders never listen to, a method he considered as part of that subject's ""reflective"" approach. This philosopher presented the state, civil society, and family as respectively representing moments of individuality, particularity, and universality. This philosopher also presented the state as the union of the ""subjective particular"" with an ""objective universal"" in a (*) compilation of lectures that claims Africa has not exhibited development. This philosopher, who formulated the concept of ""ethical life"", described a ""struggle to the death"" in which self-conscious beings recognize each other in a passage called the ""master-slave dialectic."" For 10 points, name this author of The Philosophy of Right and The Phenomenology of Spirit.","Georg_Wilhelm_Friedrich_Hegel"
"In a pair of works by this author, Timaeus describes the origin of the universe and Critias details the history of Atlantis. He wrote of Kallipolis, an ideal city-state where philosopher-kings rule, in a work that seeks to define justice for individuals and the (*) city-state. For 10 points, name this Ancient Greek philosopher, a teacher of Aristotle and author of dialogues, like The Republic, which feature his teacher, Socrates.","Plato"
"This philosopher argued that our intuition about God was the only way we could have true, or ""adequate,"" ideas. He divided nature into ""substances,"" ""attributes,"" and ""modes"" in a work that opens with fifteen axiomatic propositions. This philosopher argued that the Torah could not have been entirely written by Moses in his (*) Tractatus Theologico- Politicus. He called the control our passions have over us ""bondage,"" and he claimed that God and Nature are the same thing, thus opposing the dualism of his contemporary Descartes. For 10 points, name philosopher who wrote a ""geometrically ordered"" Ethics and was kicked out of Dutch Jewish society.","Baruch_Spinoza"
"This philosopher claimed that ""philology,"" ""biology,"" and ""economics"" did not exist before Kant in a work about the ""Human Sciences."" He called the basic intellectual assumptions of an era its episteme. This philosopher described his method as ""archaeological."" One of his books opens with an analysis of (*) Las Meninas, while another gorily describes the public torture of Robert-François Damiens. He called how nations control their subject's bodies ""biopower,"" and he characterized repressive modern societies as a kind of Panopticon. For 10 points, name this 20th-century French philosopher, who wrote The History of Sexuality, The Order of Things, and Discipline and Punish.","Michel_Foucault"
"A philosopher from this school taught Arrian, who wrote down his Discourses and Handbook. Another philosopher from this school wrote bloody tragedies like Hercules Furens. One philosopher from this school urged readers to take a ""cosmic"" perspective on things and thought about twelve phases of his life while (*) campaigning on the Rhine frontier. This school included Epictetus and was founded by Zeno of Citium. Nero was taught this philosophy by Seneca, and it is espoused by the Meditations of Marcus Aurelius. For 10 points, name this ancient philosophical school that stressed virtue and freedom from emotions.","Stoicism"
"This philosopher wrote that ""in the beginning, all the world was America,"" since people could just enclose land to own it. He argued that the use of money that doesn't naturally depreciate destroyed natural limits on accumulating wealth. This philosopher called labor added to natural resources the basis for property. He noted that the state of nature is more or less free and equal, in contrast to the pessimist (*) Hobbes. He argued that, when governments act against the interests of their citizens, revolution is justified, because the social contract has been broken. For 10 points, name this English philosopher who, in his Two Treatises of Government, wrote that people have the rights to life, liberty, and property.","John_Locke"
"This philosopher conceived of science as proceeding from self-evident first principles via demonstrative syllogisms. His works are cited using Bekker numbers. He used the example of a doctor to distinguish between empirical ""experience"" and techne, or ""art,"" in the first chapter of a work that postulates a (*) ""prime mover."" This man described virtues as means between extremes in a work that considers eudaimonia, or happiness, as the highest goal. This philosopher founded the Lyceum, and his lectures there were turned into the Organon and the Nicomachean Ethics. For 10 points, name this Greek philosopher who tutored Alexander the Great and studied with Plato.","Aristotle"
"This philosopher analyzes the word deinotaton in the ""Ode on Man"" from Sophocles's Antigone in a lecture course that analyzes the title river of a German poem as an enigma at encompasses both locality and journeying. This philosopher uses a silver chalice to illustrate Aristotle's four causes in a work that contrasts forms of revealing, or aletheia, called bringing-forth and challenging-forth. This author of (*) Hölderlin's Hymn ""The Ister"" discussed the hermeneutic circle between fundamental ontology and specific modes of existence in another work. This author of The Question Concerning Technology and ""The Origin of the Work of Art"" wrote that a hammer can be approached from the perspective of presence-at-hand or readiness-to-hand. For 10 points, name this Nazi-sympathizing phenomenologist who introduced the concept of Dasein in Being and Time.","Martin_Heidegger"
"A section of this book asserts that too much love for a thing that is ""liable to many variations and that we can never fully possess"" is ""a sickness of the mind"". It defines sensory perception, reason, and intuition as the three types of knowledge, and claims, in its third section, that humans deem things good because they strive for them. This book also claims that everything ""strives to persevere its being"", a concept referred to as conatus. Its format was influenced by (*) Euclid's Elements, as its propositions are ""demonstrated in geometrical order"". Thought and Extension are two of the attributes of God according to this book, whose final section, ""Of Human Freedom"", follows its section ""Of Human Bondage"". Its author was attacked as an atheist because it equates God with Nature. For 10 points, name this magnum opus of Baruch Spinoza.","Ethics_(Spinoza)"
"The ""common"" type of this state is defined via an infinitary hierarchical definition in David Lewis's Convention. Gilbert Ryle distinguished between the ""how"" and ""that"" forms of this state. Alvin Goldman advanced a causal theory of this state in which a fact p may cause someone to believe that p. A paper contesting a noted definition of this concept imagines that (*) Smith believes a man with ten coins in his pocket will get a job. Michel Foucault combines this term and power with a slash, and he described the disunity underlying discursive formations in a book on ""The Archaeology of"" it. Edmund Gettier contested a definition of this concept considered in Plato's Theaetetus, that of ""justified true belief."" For 10 points, name this subject matter of epistemology, the opposite of ignorance.","Knowledge"
"With Nelson Goodman, this philosopher proposed reductions of statements like ""Class A has three members."" This author of ""Steps toward a Constructive Nominalism"" proposed the dictum ""To be is to be the value of a variable"" in ""On What There Is."" He used the metaphor of belief as a web to illustrate the underdetermination of theory by experience, a thesis he names with Pierre (*) Duhem. This proponent of naturalized epistemology rejected the idea that synonymy is definition or interchangeability in a paper that attacked semantic reductionism and the analytic/synthetic division. He described an Arunta speaker pointing to a rabbit and saying ""gavagai"" to illustrate the indeterminacy of translation. For 10 points, name this American philosopher who wrote Word and Object and ""Two Dogmas of Empiricism.""","Willard_Van_Orman_Quine"
"This thinker discusses the ambivalence of ""pharmakon"" in an essay on Phaedrus, ""Plato's Pharmacy."" The two columns of another of this philosopher's works juxtapose a dissection of Hegel with a celebration of Jean Genet's writings. He called for resistance to the ""ontologization"" of Marx through a ""New International."" This author of Glas caused a sensation at a Johns Hopkins conference with his paper (*) ""Structure, Sign, and Play."" This author of Specters of Marx denoted a form of language prefiguring both speech and writing as ""arche-writing,"" enlisting it in his critique of logocentrism. In Speech and Phenomena, he critiqued Husserl's ""metaphysics of presence"" through the notion of différance. For 10 points, name this Algerian-born French philosopher who wrote Of Grammatology and developed deconstruction.","Jacques_Derrida"
"One of this thinker's works describes things that do not themselves change, but have change ""annexed to them"", as ""aeviternal"". He defined a law as ""an ordinance of reason for the common good"" and considered the difference between a ""subsistent"" and a ""substance"" in a work whose analysis of the concept of murder in self-defense gave rise to the principle of (*) double effect. Truths that surpass the capability of reason are covered in the fourth section of a book by this man that was supposedly commissioned by Raymond of Peñafort. He often refers to ""the Jurist"", ""the Commentator"", and ""the Philosopher"", or Ulpian, Averroes, and Aristotle, in a work that introduced the quinque viae, five proofs of God's existence. For 10 points, name this Dominican friar who wrote Summa Contra Gentiles and Summa Theologica.","Thomas_Aquinas"
"This man's views on being and truth are the first of three critiques of the concept of structure presented in Jacques Derrida's ""Structure, Sign, and Play."" This thinker identified free will and confusing cause and effect as two of four great errors of philosophy. This thinker ascribed decadence to the thought of (*) Socrates because it opposed life-affirmation, a process by which humans question all impediments to their ""will to power."" For 10 points, identify this thinker who punned on Wagner with the title Twilight of The Idols and wrote The Gay Science.","Friedrich_Nietzsche"
"This book was described by its author as a project of analysis, or Zergliederung, of the faculty of understanding, and its second edition had an attack on Cartesian skepticism appended to it titled The Refutation of Idealism. It argues that categories such as causality are necessary for any possible (*) experience through its ""transcendental analytic"" and introduces the concept of inherently unknowable noumena, as opposed to phenomena. For 10 points, name this book showing the existence of a priori synthetic truths by Immanuel Kant.","Critique_of_Pure_Reason"
"A work by this philosopher states that, because the world was created as an intelligent living creature, it must have a soul that is composed of Sameness, Difference, and Being. This thinker argued that understanding of non-material abstract ideas allows the highest perception of reality and was credited by Edmund Gettier as defining (*) knowledge as ""justified true belief."" The idea that each element is represented by a perfect solid was introduced by - for 10 points - what creator of the Theory of Forms, who wrote dialogues like Timaeus and Theaetetus?","Plato"
"This thinker argued that matter was a metaphor since it symbolized the unknown and that knowledge had to be characterized as ""essence"", a term he used to refer to concepts and ideas. This thinker grouped matter and essence with truth and spirit, and believed that arational awareness was the foundation of knowledge, an idea this author of (*) The Realms of Being expressed as ""philosophy begins in medias res."" For 10 points, name this author of Skepticism and Animal Faith who is best known for an aphorism about repeating the past.","George_Santayana"
"This philosopher claimed that setting theory in the syntax of first-order logic greatly simplifies it into a ""regimented"" theory. He is the alphabetically-second namesake of an argument that states that mathematical entities must be real because of their role in science, an (*) ""indispensability argument"" named for Hilary Putnam and him. Two classes of statements exemplified by ""unmarried man"" and ""bachelor"" were distinguished by - for 10 points - which philosopher, who attacked the analytic/synthetic distinction in Two Dogmas of Empiricism?","Willard_Van_Orman_Quine"
"This philosopher argued that ""cogito ergo sum"" made no sense after the ""turn"" in philosophy brought about by Kant and used the word ""discourse"" to designate a mode of speaking pertaining to unconscious rules that determine conceptual possibilities possible within an era. This philosopher initially used (*) ""archaeological"" methods to analyze the epistemes of given periods, but later used a method of ""genealogy"" which he employed to analyze the shift away from torture and execution in prisons. For 10 points, identify this author of The Order of Things and Discipline and Punish.","Michel_Foucault"
"This thinker believed that Descartes's formulation of the ontological argument was invalid since it did not have a premise that a perfect being is possible. This thinker claimed that any extrinsic difference between two substances, such as a difference in spatio-temporal location, must be due to some additional intrinsic difference. This man invoked Duns Scotus' (SKOH-tuss) term ""haecceity"" (hack-SEE-uh-tee) to argue that something is only a substance if it has a complete individual concept in Discourse on (*) Metaphysics. This formulator of the Principle of the Identity of Indiscernibles took on the persona of Theophilus (thee-AWE-fill-us) in his chapter-by-chapter refutation of Locke entitled New Essays of Human Understanding. This philosopher asserted that the Principle of Sufficient Reason means that this is the ""best of all possible worlds."" For 10 points, name this author of Theodicy who co-discovered calculus.","Gottfried_Wilhelm_Leibniz"
"A Platonic dialogue on this topic features Socrates comparing the mind to an aviary to distinguish between possessing and having. Discussions about assessing the nature of evidence and ""the right to be sure"" appear in A.J. Ayer's essay about the ""Problem"" of this concept. Three different accounts of this thing equate it with perception, true judgement, and true judgement with an account. The (*) Theatetus (THEE-ah-TAY-tuss) is a Platonic dialogue that tries to define this concept, which is also the subject of the Gettier problems, which asks if this concept is ""justified true belief."" Immanuel Kant distinguished between a priori and a posteriori types of this concept to ask if this concept could be obtained without observation. For 10 points, name this concept often equated with ""justified true belief,"" the subject of epistemology.","Knowledge"
"One of this writer's last books opens by examining G. E. Moore's statement ""If you do know that here is one hand, we'll grant you all the rest"" and considers how one truly knows what they know. Jean-Francois Lyotard's concept of metanarratives was inspired by his readings of this philosopher. This philosopher imagined a tribe of builders that each designate one of four slabs with different letters of the alphabet to to show the connection between language and action. This author of ""On Certainty"" formulated the (*) rule-following paradox in another book. This philosopher used the example of a community of people who each have a box with a beetle inside to argue that private language has no importance. For 10 points, name this philosopher who wrote Philosophical Investigations and Tractatus-Logico-Philosophicus.","Ludwig_Wittgenstein"
"This philosopher was criticized by G.E. Moore for setting an equivalence between ""is desired"" and ""is worthy of desire."" This philosopher argued that all necessity is verbal and not metaphysical, which led to a theory of names attacked by Frege (FRAY-guh) in Sense and Reference; Saul Kripke rejected this man's theory of general terms but resurrected his theory of proper names; his theory of names can be found in a work that presents five methods of (*) induction. This man identified offense, paternalism, and moralism as restrictions of liberty in a short work that introduces the ""harm principle,"" and attempts to show the equivalence between the title philosophy and justice in the last chapters of a treatise championing the ""greatest happiness principle."" For 10 points, name this English philosopher who wrote Utilitarianism.","John_Stuart_Mill"
"This man claimed ""the world is suffering from intolerance and bigotry"" in the preface to a book in which he advocates for a four-hour workday and claims ""the liberation of the oppressed has usually been inaugurated from above."" In an article criticized for mixing up ""meaning"" and ""mentioning"" by P.F. Strawson, this thinker posited an example of a phrase which describes one and only one event: ""the father of Charles II was executed."" A statement named after this author of ""In (*) Praise of Idleness"" was discovered independently by Ernst Zermelo and concludes that the set of all sets that are not members of themselves must not contain itself. For 10 points, name this author of ""On Denoting"", who co-authored Principia (preen-KEY-pee-uh) Mathematica.","Bertrand_Russell"
"An aesthetic essay by this philosopher ends by claiming that Racine's Athalie was ruined by the bigotry of the Catholic Church and claims that beauty is derived from the ""joint verdict"" of ""true judge[s]."" A book by this man ends with a paragraph discussing works containing ""sophistry and illusion"" that the reader must ""commit to the flames."" In the fourth section of that book, this man compared the ""truths demonstrated by Euclid"" with the proposition that the sun will not (*) rise tomorrow in distinguishing between ""Relations of Ideas"" and ""Matters of Fact."" This man argued that all ideas arise from ""impressions"" and discussed a problem about a missing shade of blue. For 10 points, name this Scottish empiricist and author of An Enquiry Concerning Human Understanding.","David_Hume"
"In one lecture, this thinker gave the example of a swarm of gnats to represent the unpredictable ""cloud,"" which he equated with the more orderly and steady ""clock."" This thinker adapted Alfred Tarski's thought in his application of a concept derived from the logical content of statements called truthlikeness or ""verisimilitude."" A book by this thinker asserts that Plato's idealized politics are ""fundamentally identical"" to totalitarianism in their morality in its first volume, (*) ""The Spell of Plato."" This man, who referred to his philosophy as ""critical rationalism,"" distinguished scientific statements from non-scientific statements by their falsifiability. For 10 points, name this philosopher of science, the author of The Open Society and its Enemies and The Logic of Scientific Discovery.","Karl_Popper"
"Peter Sloterdijk's ""Rules for the Human Zoo"" was written as a response to an essay by this philosopher, which itself was a response to an essay by Sartre, arguing that Sartre had misread this philosopher. Derrida borrowed this philosopher's technique of sous rature, or erasure, which involves striking out a word but leaving it visible. He adapted the ancient Greek concept of aletheia, meaning ""disclosure,"" and related it to his own notion of (*) ""world disclosure."" His magnum opus argued that individual existences are ""thrown"" into the world and used the example of reaching for a hammer to illustrate the distinction between things which are present-at-hand and those which are ready-at-hand. This author of ""The Origin of the Work of Art"" coined a term which literally means ""being there."" For 10 points, name this philosopher who coined the term Dasein in his book Being and Time.","Martin_Heidegger"
"In a section on ""combination,"" this book distinguishes the concept of ""understanding"" from ""sensibility,"" which is the ""faculty of representation."" This book argues that the cosmological argument for God, which posits ""necessary being,"" is invalid because it reduces to the ontological argument. Though not by A. J. Ayer, it introduced a distinction attacked by W. V. O. Quine's Two Dogmas of Empiricism by defining statements that affirm a predicate that belongs to a subject as (*) ""analytic,"" as contrasted with ""synthetic"" statements. This book posits the concept of the unknowable noumenon, or ""thing-in-itself,"" which humans perceive as phenomena. It gives space and time as examples of a priori synthetic truths. For 10 points, name this 1791 tome on metaphysics by Immanuel Kant, the first of three ""critiques.""","Critique_of_Pure_Reason"
"Kyoo Lee attempted to modernise this author by ""Reading [this philosopher] Otherwise."" This philosopher was compared to Daffy Duck by Steven Nadler in a biography framed by an analysis of a famous portrait of this thinker. Bernard Williams argued that this philosopher failed at his primary ambition in a book on his Project of Pure Enquiry. This philosopher's time at the Jesuit academy of La Fleche influenced the structure of his primary work, in which this thinker analogizes his method to the task of sifting rotten (*) apples from a basket by emptying it and replacing only the good apples, which can be seen as examples of what this thinker calls ""clear and distinct perceptions."" The first section of that work by this philosopher closes by imagining a malicious demon. For 10 points, name this author of Meditations on First Philosophy.","René_Descartes"
"One text from this school compares ideal behavior at a banquet to good behavior in life, and starts by distinguishing things inside and outside our control; that text of this school is the Handbook, or Enchiridion. Another author of this school thanked his grandfather Verus among many others who raised him to start off twelve books of Meditations. This school believed that virtue was the only good, and was adopted by emperor Marcus Aurelius centuries after its founding by Zeno of Citium on an Athenian porch. For 10 points, name this school of thought whose followers detached emotionally from the external world.","Stoicism"
